"**[hal-02293285]**","S. Labarre, S. Jacquemoud, [C. Ferrari](https://cv.archives-ouvertes.fr/cecile-ferrari), [Arthur Delorme](https://cv.archives-ouvertes.fr/arthur-delorme), A. Derrien, R. Grandin, M. Jalludin, François Lemaitre, [Marianne Métois](https://cv.archives-ouvertes.fr/marianne-metois), [Marc Pierrot-Deseilligny](https://cv.archives-ouvertes.fr/marc-pierrot-deseilligny), [E Rupnik](https://cv.archives-ouvertes.fr/ewelina-rupnik), Bernard Tanguy","2019","[Retrieving soil surface roughness with the Hapke photometric model: Confrontation with the ground truth](https://hal.archives-ouvertes.fr/hal-02293285)","Remote Sensing of Environment"
"**[hal-04395664]**","M. Daakir, Y. Zhou, M. Pierrot Deseilligny, C. Thom, O. Martin, Ewelina Rupnik","2019","[Improvement of photogrammetric accuracy by modeling and correcting the thermal effect on camera calibration](https://hal.archives-ouvertes.fr/hal-04395664)","ISPRS Journal of Photogrammetry and Remote Sensing"
"**[hal-02894360]**","Audrey Minghelli, [Manchun Lei](https://cv.archives-ouvertes.fr/manchun-lei), Sabine Charmasson, [Vincent Rey](https://cv.archives-ouvertes.fr/vincent-rey), Malik Chami","2019","[Monitoring Suspended Particle Matter Using GOCI Satellite Data After the Tohoku (Japan) Tsunami in 201](https://hal.archives-ouvertes.fr/hal-02894360)","IEEE Journal of Selected Topics in Applied Earth Observations and Remote Sensing"
"**[hal-02866505]**","Arzu Cöltekin, [Sidonie Christophe](https://cv.archives-ouvertes.fr/sidonie-christophe), Anthony Robinson, Urška Demšar","2019","[Designing Geovisual Analytics Environments and Displays with Humans in Mind](https://hal.archives-ouvertes.fr/hal-02866505)","ISPRS International Journal of Geo-Information"
"**[hal-02407571]**","Clément Dechesne, Sébastien Lefèvre, Rodolphe Vadaine, Guillaume Hajduch, [Ronan Fablet](https://cv.archives-ouvertes.fr/ronan-fablet-all)","2019","[Ship identification and characterization in Sentinel-1 SAR images with multi-task deep learning](https://hal.archives-ouvertes.fr/hal-02407571)","Remote Sensing"
"**[hal-02110973]**","[Matthias Jauvin](https://cv.archives-ouvertes.fr/matthias-jauvin), Yajing Yan, Emmanuel Trouvé, [Bénédicte Fruneau](https://cv.archives-ouvertes.fr/benedicte-fruneau), [Michel Gay](https://cv.archives-ouvertes.fr/michel-gay), Blaise Girard","2019","[Integration of Corner Reflectors for the Monitoring of Mountain Glacier Areas with Sentinel-1 Time Series](https://hal.archives-ouvertes.fr/hal-02110973)","Remote Sensing"
"**[hal-02423771]**","[Quy Thy Truong](https://cv.archives-ouvertes.fr/quy-thy-truong), [Guillaume Touya](https://cv.archives-ouvertes.fr/guillaume-touya), [Cyril de Runz](https://cv.archives-ouvertes.fr/cyril-de-runz)","2019","[Le vandalisme dans l’information géographique volontaire](https://hal.archives-ouvertes.fr/hal-02423771)","Revue Internationale de Géomatique"
"**[hal-02276043]**","Stefan Ivanovic, [Ana-Maria Olteanu-Raimond](https://cv.archives-ouvertes.fr/ana-maria-olteanu-raimond), Sébastien Mustière, [Thomas Devogele](https://cv.archives-ouvertes.fr/thomas-devogele)","2019","[A Filtering-Based Approach for Improving Crowdsourced GNSS Traces in a Data Update Context](https://hal.archives-ouvertes.fr/hal-02276043)","ISPRS International Journal of Geo-Information"
"**[hal-02881562]**","Saoussen Belhadj-Aissa, Faiza Hocine, [Bénédicte Fruneau](https://cv.archives-ouvertes.fr/benedicte-fruneau), Mohamed Salah Boughacha, Karima Hadj-Rabah, Aichouche Belhadj-Aissa","2019","[Contextual Filtering Methods based on the Subbands and Subspaces Decomposition of Complex SAR Interferograms](https://hal.archives-ouvertes.fr/hal-02881562)","IEEE Journal of Selected Topics in Applied Earth Observations and Remote Sensing"
"**[hal-03385014]**","[Catherine Dominguès](https://cv.archives-ouvertes.fr/catherine-domingues), Laurence Jolivet, [Carmen Brando](https://cv.archives-ouvertes.fr/carmen-brando), Marion Cargill","2019","[Place and Sentiment-based Life story Analysis](https://hal.archives-ouvertes.fr/hal-03385014)","Revue française des sciences de l'information et de la communication"
"**[hal-02284935]**","Laura F Julià, [Pascal Monasse](https://cv.archives-ouvertes.fr/pascal-monasse), [Marc Pierrot-Deseilligny](https://cv.archives-ouvertes.fr/marc-pierrot-deseilligny)","2019","[The Orthographic Projection Model for Pose Calibration of Long Focal Images](https://hal.archives-ouvertes.fr/hal-02284935)","Image Processing On Line"
"**[hal-01980146]**","[Guillaume Touya](https://cv.archives-ouvertes.fr/guillaume-touya), [Sidonie Christophe](https://cv.archives-ouvertes.fr/sidonie-christophe), [Jean-Marie Favreau](https://cv.archives-ouvertes.fr/jean-marie-favreau), Amine Ben Rhaiem","2019","[Automatic derivation of on-demand tactile maps for visually impaired people: first experiments and research agenda](https://hal.archives-ouvertes.fr/hal-01980146)","International Journal of Cartography"
"**[insu-01708999]**","Ana Claudia Parracho, [Olivier Bock](https://cv.archives-ouvertes.fr/olivier-bock), [Sophie Bastin](https://cv.archives-ouvertes.fr/sophie-bastin)","2018","[Global IWV trends and variability in atmospheric reanalyses and GPS observations](https://hal.archives-ouvertes.fr/insu-01708999)","Atmospheric Chemistry and Physics"
"**[hal-01933956]**","M. Aloy, W. Anderson, M. Arène, G. Arun, François Aubin, F. Badaracco, W. Ballmer, S. Barnum, D. Beniwal, M. Bensch, S. Bernuzzi, A. Bilgili, Y. Boetzel, P. Booker, C. Booth, V. Bossilkov, J. Bosveld, A. Bramley, F. Brighenti, G. Carullo, J. Casanueva Diaz, O. Chaibi, K. Chatziioannou, Y. Chia, W. Chung, A. Ciobanu, F. Cipriano, C. Collins, R. Cotesta, M. Deenadayalan, J. Derby, T. Dietrich, B. Ding, A. Dmitriev, J. Easter, M. Eisenmann, H. Estelles, F. Feng, J. Fishner, A. Gabbard, A. Garcia, C. García-Quirós, B. Giacomazzo, G. Giordano, R. Green, H. Gulati, H. Hamilton, J. Hernandez, C. Ho, S. Hochheim, A. Holland, M. Hulko, A. Iess, C. Ingram, S. Irwin, S. Johnson, V. Keerthana, Y. Khalili, B. Khamesra, H. Khan, Y. Kim, B. Krishnan, P. Landry, J. Li, T.B. Littenberg, A. Longo, J. Mccann, D. Mendoza-Gandara, A. Miller, J. Mills, S. Morisaki, A. Nagar, Y. Ng, S. Ng, P. Nguyen, M. Obergaulinger, B. O’brien, H. Ohta, G. Pagano, B. Abbott, R. Abbott, T. Abbott, F. Acernese, K. Ackley, C. Adams, T. Adams, P. Addesso, R. Adhikari, B. Adya, C. Affeldt, M. Afrough, B. Agarwal, M. Agathos, K. Agatsuma, N. Aggarwal, D. Aguiar, L. Aiello, A. Ain, P. Ajith, B. Allen, G. Allen, A. Allocca, A. Altin, A. Amato, A. Ananyeva, S. Anderson, G. Anderson, S. Angelova, S. Antier, S. Appert, K. Arai, M. Araya, J. Areeda, [Nicolas Arnaud](https://cv.archives-ouvertes.fr/nicolas-arnaud), S. Ascenzi, G. Ashton, M. Ast, M. Aston, P. Astone, D. Atallah, P. Aufmuth, C. Aulbert, K. Aultoneal, C. Austin, A. Avila-Alvarez, [Stanislav Babak](https://cv.archives-ouvertes.fr/stanislav-babak), Philippe Bacon, M. Bader, S. Bae, T. Baker, F. Baldaccini, G. Ballardin, S. Ballmer, S. Banagiri, J. Barayoga, S. Barclay, C. Barish, D. Barker, K. Barkett, F. Barone, B. Barr, L. Barsotti, M. Barsuglia, D. Barta, James G. Bartlett, I. Bartos, R. Bassiri, A. Basti, J. Batch, M. Bawaj, J. Bayley, M. Bazzan, B. Bécsy, C. Beer, Michal Bejger, I. Belahcene, A. Bell, B. Berger, G. Bergmann, J. Bero, C. Berry, D. Bersanetti, A. Bertolini, J. Betzwieser, S. Bhagwat, R. Bhandare, A. Bilenko, G. Billingsley, C. Billman, J. Birch, R. Birney, O. Birnholtz, S. Biscans, S. Biscoveanu, A. Bisht, M. Bitossi, C. Biwer, [Marie-Anne Bizouard](https://cv.archives-ouvertes.fr/marie-anne-bizouard), J. Blackburn, Joshua Blackman, C. Blair, G. Blair, M. Blair, S. Bloemen, O. Bock, N. Bode, [M Boer](https://cv.archives-ouvertes.fr/michel-boer), [G. Bogaert](https://cv.archives-ouvertes.fr/gilles-bogaert), A. Bohe, E. Bonilla, R. Bonnand, A. Boom, R. Bork, V. Boschi, S. Bose, K. Bossie, Y. Bouffanais, A. Bozzi, C. Bradaschia, P. Brady, M. Branchesi, J. Brau, T. Briant, A. Brillet, M. Brinkmann, V. Brisson, P. Brockill, J. Broida, A. Brooks, A. Brown, D. Brown, S. Brunett, C. Buchanan, A. Buikema, T. Bulik, J. Bulten, A. Buonanno, D. Buskulic, C. Buy, L. Byer, D. Buskulic, L. Cadonati, G. Cagnoli, C. Cahillane, J. Calderón Bustillo, T. Callister, E. Calloni, J. Camp, M. Canepa, P. Canizares, C. Cannon, H. Cao, J. Cao, C. Capano, E. Capocasa, F. Carbognani, S. Caride, M. Carney, C. Casentini, S. Caudill, M. Cavaglià, [F. Cavalier](https://cv.archives-ouvertes.fr/fabien-cavalier), R. Cavalieri, G. Cella, C. Cepeda, P. Du, G. Cerretani, E. Cesarini, J. Chamberlin, M. Chan, S. Chao, P. Charlton, E. Chase, [Eric Chassande-Mottin](https://cv.archives-ouvertes.fr/eric-chassande-mottin), D. Chatterjee, B. Cheeseboro, H. Chen, X. Chen, Y. Chen, H. Cheng, H. Chia, A. Chincarini, A. Chiummo, T. Chmiel, H. Cho, M. Cho, J. Chow, N. Christensen, Q. Chu, J. Chua, S. Chua, A. Chung, S. Chung, G. Ciani, R. Ciolfi, C. Cirelli, A. Cirone, F. Clara, J. Clark, P. Clearwater, F. Cleva, C. Cocchieri, E. Coccia, P. Cohadon, D. Cohen, A. Colla, C. Collette, L. Cominsky, M. Constancio, L. Conti, J. Cooper, P. Corban, T. Corbitt, I. Cordero-Carrión, K. Corley, N. Cornish, A. Corsi, S. Cortese, C. Costa, E. Coughlin, M. Coughlin, S. Coughlin, J. Coulon, T. Countryman, P. Couvares, B. Covas, E. Cowan, M. Coward, J. Cowart, C. Coyne, R. Coyne, J. Creighton, T. Creighton, J. Cripe, S. Crowder, J. Cullen, A. Cumming, L. Cunningham, E. Cuoco, T. Canton, G. Dálya, L. Danilishin, S. D’antonio, K. Danzmann, A. Dasgupta, C. Silva, V. Dattilo, I. Dave, M. Davier, D. Davis, J. Daw, B. Day, S. De, D. Debra, [J. Degallaix](https://cv.archives-ouvertes.fr/jerome-degallaix), M. de Laurentis, [Samuel Deléglise](https://cv.archives-ouvertes.fr/samuel-deleglise), W. del Pozzo, N. Demos, T. Denker, T. Dent, R. de Pietri, V. Dergachev, Robert de Rosa, T. Derosa, C. Ross, R. Desalvo, O. de Varona, J. Devenson, S. Dhurandhar, M. Díaz, L. Di Fiore, M. Di Giovanni, T. Di Girolamo, A. Li, S. Pace, I. Di Palma, F. Ren, Z. Doctor, V. Dolique, F. Donovan, L. Dooley, S. Doravari, I. Dorrington, R. Douglas, M. Dovale Álvarez, T. Downes, M. Drago, C. Dreissigacker, J. Driggers, Z. Du, M. Ducrot, P. Dupej, S. Dwyer, T. Edo, M. Edwards, A. Effler, H. Eggenstein, P. Ehrens, J. Eichholz, S. Eikenberry, A. Eisenstein, C. Essick, D. Estevez, Z. Etienne, T. Etzel, M. Evans, M. Factourovich, V. Fafone, H. Fair, S. Fairhurst, X. Fan, S. Farinon, B. Farr, M. Farr, J. Jones, M. Favata, M. Fays, C. Fee, H. Fehrmann, J. Feicht, M. Fejer, A. Fernandez-Galiana, I. Ferrante, C. Ferreira, F. Ferrini, F. Fidecaro, D. Finstad, I. Fiori, D. Fiorucci, M. Fishbach, P. Fisher, M. Fitz-Axen, R. Flaminio, M. Fletcher, H. Fong, J. Font, W. Forsyth, S. Forsyth, [Jerome Fournier](https://cv.archives-ouvertes.fr/jerome-fournier), S. Frasca, F. Frasconi, Z. Frei, A. Freise, R. Frey, V. Frey, M. Fries, P. Fritschel, V. Frolov, P. Fulda, M. Fyffe, H. Gabbard, B. Gadre, M. Gaebel, J. Gair, L. Gammaitoni, M. Ganija, S. Gaonkar, C. Garcia-Quiros, F. Garufi, B. Gateley, S. Gaudio, G. Gaur, V. Gayathri, N. Gehrels, G. Gemme, E. Genin, A. Gennai, D. George, J. George, L. Gergely, V. Germain, S. Ghonge, Abhirup Ghosh, Archisman Ghosh, S. Ghosh, J. Giaime, D. Giardina, A. Giazotto, K. Gill, L. Glover, E. Goetz, R. Goetz, S. Gomes, B. Goncharov, G. González, J. Gonzalez Castro, A. Gopakumar, M. Gorodetsky, S. Gossan, M. Gosselin, R. Gouaty, A. Grado, C. Graef, M. Granata, A. Grant, S. Gras, C. Gray, G. Greco, C. Green, M. Gretarsson, P. Groot, H. Grote, S. Grunewald, P. Grüning, M. Guidi, X. Guo, A. Gupta, M. Gupta, K. Gushwa, K. Gustafson, R. Gustafson, O. Halim, B. Hall, D. Hall, Z. Hamilton, G. Hammond, M. Haney, M. Hanke, J. Hanks, C. Hanna, M. Hannam, A. Hannuksela, J. Hanson, T. Hardwick, J. Harms, M. Harry, W. Harry, J. Hart, J. Haster, K. Haughian, J. Healy, A. Heidmann, M. Heintze, H. Heitmann, P. Hello, G. Hemming, M. Hendry, S. Heng, J. Hennig, A. Heptonstall, M. Heurs, S. Hild, T. Hinderer, D. Hoak, D. Hofman, K. Holt, D. Holz, P. Hopkins, C. Horst, J. Hough, A. Houston, J. Howell, A. Hreibi, M. Hu, A. Huerta, D. Huet, B. Hughey, S. Husa, H. Huttner, T. Huynh-Dinh, N. Indik, R. Inta, G. Intini, H. Isa, J. Isac, M. Isi, B. Iyer, K. Izumi, [Thibaut Jacqmin](https://cv.archives-ouvertes.fr/thibaut-jacqmin), K. Jani, P. Jaranowski, S. Jawahar, F. Jiménez-Forteza, W. Johnson, D. Jones, R. Jones, J. Jonker, L. Ju, J. Junker, C. Kalaghatgi, V. Kalogera, B. Kamai, S. Kandhasamy, G. Kang, J. Kanner, J. Kapadia, S. Karki, S. Karvinen, M. Kasprzack, M. Katolik, E. Katsavounidis, W. Katzman, S. Kaufer, K. Kawabe, [Fabien Kéfélian](https://cv.archives-ouvertes.fr/fabien-kefelian), D. Keitel, J. Kemball, R. Kennedy, C. Kent, J. Key, F. Khalili, I. Khan, S. Khan, Z. Khan, A. Khazanov, N. Kijbunchoo, Chunglee Kim, J. Kim, K. Kim, W. Kim, S. Kim, M. Kim, J. Kimbrell, J. King, M. Kinley-Hanlon, R. Kirchhoff, J. Kissel, L. Kleybolte, S. Klimenko, T. Knowles, P. Koch, M. Koehlenbeck, S. Koley, V. Kondrashov, A. Kontos, M. Korobko, Z. Korth, I. Kowalska, B. Kozak, C. Krämer, V. Kringel, A. Królak, G. Kuehn, S.M. Koehlenbeck, R. Kumar, V. Kondrashov, L. Kuo, A. Kutynia, S. Kwang, B. Lackey, H. Lai, M. Landry, R. Lang, J. Lange, B. Lantz, K. Lanza, D. Lasky, M. Laxen, A. Lazzarini, C. Lazzaro, P. Leaci, S. Leavey, C. Lee, M. Lee, H. Lee, K. Lee, J. Lehmann, A. Lenon, M. Leonardi, [N. Leroy](https://cv.archives-ouvertes.fr/nicolas-leroy-cnrs), N. Letendre, Y. Levin, T. Li, S. Linker, T. Littenberg, J. Liu, L. Lo, A. Lockerbie, T. London, J. Lord, M. Lorenzini, [Vincent Loriette](https://cv.archives-ouvertes.fr/vincent-loriette), M. Lormand, G. Losurdo, J. Lough, C. Lousto, G. Lovelace, H. Lück, D. Lumaca, A. Lundgren, R. Lynch, Y. Ma, R. Macas, S. Macfoy, B. Machenschalk, M. Macinnis, M. Macleod, I. Magaña Hernandez, F. Magaña-Sandoval, L. Magaña Zertuche, M. Magee, E. Majorana, I. Maksimovic, N. Man, V. Mandic, V. Mangano, L. Mansell, M. Manske, M. Mantovani, F. Marchesoni, F. Marion, S. Márka, Z. Márka, C. Markakis, A. Markosyan, A. Markowitz, E. Maros, A. Marquina, F. Martelli, L. Martellini, W. Martin, M. Martin, D. Martynov, K. Mason, E. Massera, A. Masserot, J. Massinger, Juliet Ritchie Patterson, S. Mastrogiovanni, A. Matas, F. Matichard, L. Matone, N. Mavalvala, N. Mazumder, R. Mccarthy, D. Mcclelland, S. Mccormick, L. Mcculler, C. Mcguire, G. Mcintyre, J. Mciver, J. Mcmanus, L. Mcneill, T. Mcrae, T. Williams, D. Meacher, G. Meadors, M. Mehmet, J. Meidam, E. Mejuto-Villa, A. Melatos, G. Mendell, A. Mercer, L. Merilh, Mourad Merzougui, S. Meshkov, C. Messenger, C. Messick, R. Metzdorff, M. Meyers, H. Miao, C. Michel, H. Middleton, E. Mikhailov, L. Milano, L. Miller, B. Miller, J. Miller, M. Millhouse, M. Milovich-Goff, O. Minazzoli, Y. Minenkov, J. Ming, C. Mishra, S. Mitra, P. Mitrofanov, G. Mitselmakher, R. Mittleman, D. Moffa, A. Moggi, K. Mogushi, M. Mohan, S. Mohapatra, M. Montani, J. Moore, D. Moraru, Gerardo Moreno, S. Morriss, B. Mours, M. Mow-Lowry, G. Mueller, A. Muir, Arunava Mukherjee, Arunava Mukherjee, S. Mukherjee, N. Mukund, A. Mullavey, J. Munch, A. Muñiz, M. Muratore, G. Murray, K. Napier, I. Nardecchia, L. Naticchioni, K. Nayak, J. Neilson, G. Nelemans, J. Nelson, M. Nery, A. Neunzert, L. Nevin, J. Newport, G. Newton, K. Ng, T. Nguyen, D. Nichols, A. b. Nielsen, S. Nissanke, A. Nitz, A. Noack, F. Nocera, D. Nolting, C. North, L. Nuttall, J. Oberling, G. O’dea, H. Ogin, J. Oh, H. Oh, F. Ohme, M. Okada, M. Oliver, P. Oppermann, J. Oram, B. Rei, R. Ormiston, L. Ortega, R. O’shaughnessy, S. Ossokine, J. Ottaway, H. Overmier, J. Owen, A. Pace, J. Page, M. Page, A. Pai, J. Palamos, O. Palashov, C. Palomba, A. Singh, Howard Pan, Huang-Wei Wei, B. Pang, T. Pang, C. Pankow, F. Pannarale, C. Pant, F. Paoletti, A. Paoli, M. Papa, A. Parida, W. Parker, D. Pascucci, A. Pasqualetti, R. Passaquieti, D. Passuello, M. Patil, B. Patricelli, L. Pearlstone, M. Pedraza, R. Pedurand, L. Pekowsky, A. Pele, S. Penn, J. Perez, A. Perreca, M. Perri, H. Pfeiffer, M. Phelps, J. Piccinni, M. Pichot, F. Piergiovanni, V. Pierro, G. Pillant, L. Pinard, M. Pinto, M. Pirello, M. Pitkin, M. Poe, R. Poggiani, P. Popolizio, K. Porter, A. Post, J. Powell, J. Prasad, J. Pratt, G. Pratten, V. Predoi, T. Prestegard, M. Prijatelj, M. Principe, S. Privitera, A. Prodi, L. Prokhorov, O. Puncken, M. Punturo, P. Puppo, M. Pürrer, H. Qi, V. Quetschke, A. Quintero, R. Quitzow-James, J. Raab, S. Rabeling, H. Radkins, P. Raffai, S. Raja, C. Rajan, B. Rajbhandari, M. Rakhmanov, K. Ramirez, A. Ramos-Buades, P. Rapagnani, V. Raymond, M. Razzano, J. Read, T. Regimbau, L. Rei, S. Reid, H. Reitze, W. Ren, S. Reyes, F. Ricci, M. Ricker, S. Rieger, K. Riles, M. Rizzo, A. Robertson, R. Robie, [Florent Robinet](https://cv.archives-ouvertes.fr/florent-robinet), A. Rocchi, [L. Rolland](https://cv.archives-ouvertes.fr/loic-rolland), J. Rollins, J. Roma, J. Romano, R. Romano, C. Romel, J. Romie, [François Bondu](https://cv.archives-ouvertes.fr/francois-bondu), [Angélique Lartaux-Vollard](https://cv.archives-ouvertes.fr/angelique-lartaux)","2018","[Search for tensor, vector, and scalar polarizations in the stochastic gravitational-wave background](https://hal.archives-ouvertes.fr/hal-01933956)","Physical Review Letters"
"**[insu-01570247]**","[Dunya Alraddawi](https://cv.archives-ouvertes.fr/dunya-alraddawi), Alain Sarkissian, Philippe Keckhut, [Olivier Bock](https://cv.archives-ouvertes.fr/olivier-bock), Stefan Noël, [Slimane Bekki](https://cv.archives-ouvertes.fr/slimane-bekki), [Abdanour Irbah](https://cv.archives-ouvertes.fr/abdanour-irbah), Mustapha Meftah, Chantal Claud","2018","[Comparison of total water vapour content in the Arctic derived from GNSS, AIRS, MODIS and SCIAMACHY](https://hal.archives-ouvertes.fr/insu-01570247)","Atmospheric Measurement Techniques"
"**[hal-01806692]**","Justin Berli, [Mattia Bunel](https://cv.archives-ouvertes.fr/mattia-bunel), [César Ducruet](https://cv.archives-ouvertes.fr/cesar-ducruet)","2018","[Sea-Land Interdependence in the Global Maritime Network: the Case of Australian Port Cities](https://hal.archives-ouvertes.fr/hal-01806692)","Networks and Spatial Economics"
"**[hal-02370166]**","Cyril Wendl, [Arnaud Le Bris](https://cv.archives-ouvertes.fr/arnaud-le-bris), Nesrine Chehata, Anne Puissant, Tristan Postadjian","2018","[Fusion tardive d’images SPOT 6/7 et de données multitemporelles Sentinel-2 pour la détection de la tache urbaine](https://hal.archives-ouvertes.fr/hal-02370166)","Revue Française de Photogrammétrie et de Télédétection"
"**[hal-04395671]**","Yilin Zhou, [E Rupnik](https://cv.archives-ouvertes.fr/ewelina-rupnik), Paul-Henri Faure, Marc Pierrot-Deseilligny","2018","[GNSS-Assisted Integrated Sensor Orientation with Sensor Pre-Calibration for Accurate Corridor Mapping](https://hal.archives-ouvertes.fr/hal-04395671)","Sensors"
"**[hal-02338240]**","Abdalbassir Abou-Elailah, [Isabelle Bloch](https://cv.archives-ouvertes.fr/isabelle-bloch), [Valérie Gouet-Brunet](https://cv.archives-ouvertes.fr/valerie-gouet-brunet)","2018","[Unsupervised detection of ruptures in spatial relationships in video sequences based on log-likelihood ratio](https://hal.archives-ouvertes.fr/hal-02338240)","Pattern Analysis and Applications"
"**[hal-02375987]**","Jan Dirk Wegner, Devis Tuia, Michael Yang, [Clément Mallet](https://cv.archives-ouvertes.fr/clement-mallet)","2018","[Foreword to the theme issue on geospatial computer vision](https://hal.archives-ouvertes.fr/hal-02375987)","ISPRS Journal of Photogrammetry and Remote Sensing"
"**[hal-03742661]**","J. Müller, D. Dirkx, S. M. Kopeikin, [Guillaume Lion](https://cv.archives-ouvertes.fr/guillaume-lion), Isabelle Panet, Gérard Petit, Pieter N. A. M. Visser","2018","[High Performance Clocks and Gravity Field Determination](https://hal.archives-ouvertes.fr/hal-03742661)","Space Science Reviews"
"**[hal-01947724]**","A. Walpersdorf, L. Pinget, P. Vernant, C. Sue, Aline Déprez, Stephane Baize, Pascale Bascou, Sandrine Baudin, [Olivier Bock](https://cv.archives-ouvertes.fr/olivier-bock), [Pierre Briole](https://cv.archives-ouvertes.fr/pierre-briole), José Cali, Jean-Paul Cardagliaguet, [Cedric Champollion](https://cv.archives-ouvertes.fr/c-champollion), [Olivier Charade](https://cv.archives-ouvertes.fr/olivier-charade), Jean Chéry, Nathalie Cotte, [Olivier Dauteuil](https://cv.archives-ouvertes.fr/odauteuil), Erik Doerflinger, Thierry Duquesnoy, Romain Fages, [G. Ferhat](https://cv.archives-ouvertes.fr/gilbert-ferhat), Mireille Flouzat, Bruno Garayt, [Michel Gay](https://cv.archives-ouvertes.fr/michel-gay), Médéric Gravelle, Mikaël Guichard, Jacques Hinderer, François Jouanne, Charly Lallemand, [Frédéric Masson](https://cv.archives-ouvertes.fr/frederic-masson), Elise-Rachel Mathis, Stéphane Mazzotti, [Jean-Luc Menut](https://cv.archives-ouvertes.fr/jean-luc-menut), Frédérique Moreau, [Laurent Morel](https://cv.archives-ouvertes.fr/laurent-morel), Joëlle Nicolas, [Jean-Mathieu Nocquet](https://cv.archives-ouvertes.fr/jean-mathieu-nocquet), [Laurent Ott](https://cv.archives-ouvertes.fr/laurentott), Félix Perosanz, Thierry Person, Etienne Poirier, [Alexis Rigo](https://cv.archives-ouvertes.fr/alexis-rigo), [Lucie Rolland](https://cv.archives-ouvertes.fr/lucie-rolland), Alvaro Santamaria-Gomez, Sébastien Saur, [O. Scotti](https://cv.archives-ouvertes.fr/oona-scotti), [Anne Socquet](https://cv.archives-ouvertes.fr/socqueta), Patrice Ulrich, [Joël van Baelen](https://cv.archives-ouvertes.fr/joel-van-baelen), [Mathilde Vergnolle](https://cv.archives-ouvertes.fr/mathilde-vergnolle), Maurin Vidal, Christophe Vigny, Thierry Villemin, [Guy Woppelmann](https://cv.archives-ouvertes.fr/guy-woppelmann), [Stéphane Durand](https://cv.archives-ouvertes.fr/steph-durand)","2018","[Does Long-Term GPS in the Western Alps Finally Confirm Earthquake Mechanisms?](https://hal.archives-ouvertes.fr/hal-01947724)","Tectonics"
"**[hal-01809743]**","[Denis Feurer](https://cv.archives-ouvertes.fr/denis-feurer), Olivier Planchon, Mohamed Amine El Maaoui, Abir Ben Slimane, Mohamed Rached Boussema, [Marc Pierrot-Deseilligny](https://cv.archives-ouvertes.fr/marc-pierrot-deseilligny), [Damien Raclot](https://cv.archives-ouvertes.fr/damien-raclot)","2018","[Using kites for 3-D mapping of gullies at decimetre-resolution over several square kilometres: a case study on the Kamech catchment, Tunisia](https://hal.archives-ouvertes.fr/hal-01809743)","Natural Hazards and Earth System Sciences"
"**[hal-02370181]**","[Arnaud Le Bris](https://cv.archives-ouvertes.fr/arnaud-le-bris), [Sébastien Giordano](https://cv.archives-ouvertes.fr/sebastien-giordano), [Clément Mallet](https://cv.archives-ouvertes.fr/clement-mallet)","2018","[Vers une remise en géométrie automatique des prises de vue aériennes historiques photogrammétriques](https://hal.archives-ouvertes.fr/hal-02370181)","Revue Française de Photogrammétrie et de Télédétection"
"**[hal-01322822]**","[Pierre Biasutti](https://cv.archives-ouvertes.fr/pierre-biasutti), [Jf Aujol](https://cv.archives-ouvertes.fr/jaujol), [Mathieu Brédif](https://cv.archives-ouvertes.fr/mathieu-bredif), [Aurélie Bugeau](https://cv.archives-ouvertes.fr/bugeau)","2018","[Diffusion and inpainting of reflectance and height LiDAR orthoimages](https://hal.archives-ouvertes.fr/hal-01322822)","Computer Vision and Image Understanding"
"**[hal-02384430]**","[Clément Mallet](https://cv.archives-ouvertes.fr/clement-mallet), [Nesrine Chehata](https://cv.archives-ouvertes.fr/nesrine-chehata), [Mauro Dalla Mura](https://cv.archives-ouvertes.fr/maurodallamura), [Jean-Emmanuel Deschaud](https://cv.archives-ouvertes.fr/jean-emmanuel.deschaud), [Mathieu Fauvel](https://cv.archives-ouvertes.fr/mathieu-fauvel), [Ronan Fablet](https://cv.archives-ouvertes.fr/ronan-fablet-all), Cyrielle Guérin, Emmanuel Trouvé","2018","[Editorial pour le numéro spécial CFPT'2018](https://hal.archives-ouvertes.fr/hal-02384430)","Revue Française de Photogrammétrie et de Télédétection"
"**[insu-03589357]**","Isabelle Panet, Sylvain Bonvalot, [Clément Narteau](https://cv.archives-ouvertes.fr/narteau), Dominique Remy, Jean-Michel Lemoine","2018","[Migrating pattern of deformation prior to the Tohoku-Oki earthquake revealed by GRACE data](https://hal.archives-ouvertes.fr/insu-03589357)","Nature Geoscience"
"**[hal-01756975]**","[Pierre Biasutti](https://cv.archives-ouvertes.fr/pierre-biasutti), [Jf Aujol](https://cv.archives-ouvertes.fr/jaujol), [Mathieu Brédif](https://cv.archives-ouvertes.fr/mathieu-bredif), [Aurélie Bugeau](https://cv.archives-ouvertes.fr/bugeau)","2018","[Range-Image: Incorporating sensor topology for LiDAR point cloud processing](https://hal.archives-ouvertes.fr/hal-01756975)","Photogrammetric engineering and remote sensing"
"**[hal-02369304]**","[E Rupnik](https://cv.archives-ouvertes.fr/ewelina-rupnik), [Marc Pierrot-Deseilligny](https://cv.archives-ouvertes.fr/marc-pierrot-deseilligny), [Arthur Delorme](https://cv.archives-ouvertes.fr/arthur-delorme)","2018","[3D reconstruction from multi-view VHR-satellite images in MicMac](https://hal.archives-ouvertes.fr/hal-02369304)","ISPRS Journal of Photogrammetry and Remote Sensing"
"**[hal-02388035]**","Rémi Cura, Bertrand Dumenieu, [Nathalie Abadie](https://cv.archives-ouvertes.fr/nathalie-abadie), Benoit Costes, [Julien Perret](https://cv.archives-ouvertes.fr/julienperret), Maurizio Gribaudi","2018","[Historical collaborative geocoding](https://hal.archives-ouvertes.fr/hal-02388035)","ISPRS International Journal of Geo-Information"
